{
  "schema_version": 1,
  "reviewed_at": "2026-09-13",
  "status": "pre-build-evidence-not-install-authorization",
  "catalogue_revision": "2026-09-16-manifest-and-migration",
  "records": [
    {
      "capability_id": "ansible-core",
      "status": "accepted",
      "proposed_channel": "uv-lock",
      "evidence": [
        {
          "url": "https://pypi.org/pypi/ansible-core/json",
          "sha256": "8421ac419d0218f3fb534b6e71bfb2f32d612add1a2276c109b1f83d43b68fde",
          "description": "ansible-core-pypi.json"
        }
      ],
      "artifacts": [
        {
          "name": "ansible_core-2.21.4-py3-none-any.whl",
          "version": "2.21.4",
          "platform": "python",
          "url": "https://files.pythonhosted.org/packages/a1/05/d4e28474dd027db4d60fef2422cf6bc80df100ab32e5fa5e7aad898ffd55/ansible_core-2.21.4-py3-none-any.whl",
          "digest": "sha256:ebe74d9c8fadcb41ad2151e031bf1e785e3098aaa015019b4e19a0a96f0dcc4f",
          "verification": "published-only"
        }
      ],
      "licence_observations": [
        {
          "source": "https://pypi.org/project/ansible-core/2.21.4/",
          "labels": [
            "GPL-3.0-or-later"
          ],
          "scope": "Publisher metadata; review distributions and dependencies."
        }
      ],
      "remaining": [
        "Licence text observed: GPL-3.0-or-later."
      ],
      "python_requires": ">=3.12"
    },
    {
      "capability_id": "ansible-lint",
      "status": "accepted",
      "proposed_channel": "uv-lock",
      "evidence": [
        {
          "url": "https://pypi.org/pypi/ansible-lint/json",
          "sha256": "8d6e3e7d17b7e31a310145d74e41cf95f5f82943a93ebcd0266c809aaef11880",
          "description": "ansible-lint-pypi.json"
        }
      ],
      "artifacts": [
        {
          "name": "ansible_lint-26.8.0-py3-none-any.whl",
          "version": "26.8.0",
          "platform": "python",
          "url": "https://files.pythonhosted.org/packages/69/27/c9707a6165683c85ff67cb8e5efa5238ecf26dac0626955971ef02108e84/ansible_lint-26.8.0-py3-none-any.whl",
          "digest": "sha256:94e58501cc7fafaa505dd9daea3bddb4affa6e8efe8217323c06d7194a312f57",
          "verification": "published-only"
        }
      ],
      "licence_observations": [
        {
          "source": "https://pypi.org/project/ansible-lint/26.8.0/",
          "labels": [
            "GPL-3.0-or-later"
          ],
          "scope": "Publisher metadata; review distributions and dependencies."
        }
      ],
      "remaining": [
        "Licence text observed: GPL-3.0-or-later."
      ],
      "python_requires": ">=3.10"
    },
    {
      "capability_id": "bitwarden",
      "status": "accepted",
      "proposed_channel": "candidate-snap",
      "evidence": [
        {
          "url": "https://api.snapcraft.io/v2/snaps/info/bitwarden",
          "sha256": "e5cf0da3fb08198334219b35168a0a791a5220a1ae7b9aa6fd18738b01682e7a",
          "description": "snap-bitwarden.json"
        }
      ],
      "artifacts": [
        {
          "name": "bitwarden",
          "version": "2026.8.0",
          "platform": "linux-amd64",
          "url": "https://api.snapcraft.io/api/v1/snaps/download/Nvk8FZTYrAYFKXN74w5LtOrnOhE38fU8_169.snap",
          "digest": "sha3-384:fd7bf5948cf564a3cf877e16632182ef7ef79c09202788016805daa266b7b7b7fbab69c9dd7f38cf346b303913db6f92",
          "verification": "published-only"
        }
      ],
      "licence_observations": [],
      "remaining": [
        "GPL-3.0 by default. Code under /bitwarden_license is covered by the Bitwarden License v1.0 instead; the published client mixes both."
      ],
      "snap_observation": {
        "publisher": {
          "display-name": "8bit Solutions LLC",
          "id": "SflUpHyJuL9BkjUnFAgINhCW9QjI5tow",
          "username": "bitwarden",
          "validation": "verified"
        },
        "licence": "GPL-3.0",
        "revision": 169,
        "channel": "latest/stable"
      }
    },
    {
      "capability_id": "chezmoi",
      "status": "accepted",
      "proposed_channel": "upstream-release",
      "evidence": [
        {
          "url": "https://raw.githubusercontent.com/twpayne/chezmoi/HEAD/LICENSE",
          "sha256": "6ce2375d89522ac7a1417320c8406886bc0ecb984baf41e3c27b8a07a81a30b2",
          "description": "chezmoi-license.txt"
        },
        {
          "url": "https://api.github.com/repos/twpayne/chezmoi/releases/latest",
          "sha256": "5e453317393d351e92eb40b831847dc68d21c2471b235b95fa6dd106db2114b0",
          "description": "chezmoi-release.json"
        }
      ],
      "artifacts": [
        {
          "name": "chezmoi-linux-amd64",
          "version": "v2.72.1",
          "platform": "linux-amd64",
          "url": "https://github.com/twpayne/chezmoi/releases/download/v2.72.1/chezmoi-linux-amd64",
          "digest": "sha256:37d14903fd222f5da73ffd677198ee123d31c7f395e460def32e157c8fdd4766",
          "verification": "published-only"
        }
      ],
      "licence_observations": [
        {
          "source": "https://raw.githubusercontent.com/twpayne/chezmoi/HEAD/LICENSE",
          "labels": [
            "MIT text observed"
          ],
          "sha256": "6ce2375d89522ac7a1417320c8406886bc0ecb984baf41e3c27b8a07a81a30b2",
          "scope": "Source text observation; not a release-specific licence approval."
        }
      ],
      "remaining": [
        "Licence reviewed in the capability catalogue."
      ]
    },
    {
      "capability_id": "claude-code",
      "status": "accepted",
      "proposed_channel": "upstream-release",
      "evidence": [
        {
          "url": "https://storage.googleapis.com/claude-code-dist-86c565f3-f756-42ad-8dfa-d59b1c096819/claude-code-releases/2.1.236/manifest.json",
          "sha256": "7f376665547ee9034d06089279c229d90830884af9ff721e18e89cb113c4b8dd",
          "description": "claude-manifest.json"
        }
      ],
      "artifacts": [
        {
          "name": "claude",
          "version": "2.1.236",
          "platform": "linux-amd64",
          "url": "https://storage.googleapis.com/claude-code-dist-86c565f3-f756-42ad-8dfa-d59b1c096819/claude-code-releases/2.1.236/linux-x64/claude",
          "digest": "sha256:6c8818fa22187aa555c242be4abbacc44d6b71a32ac9631ee7b2b5d12f51f752",
          "verification": "published-only"
        }
      ],
      "licence_observations": [],
      "remaining": [
        "Proprietary vendor terms. Accepted for personal use on this workstation; no redistribution right is granted."
      ]
    },
    {
      "capability_id": "cline",
      "status": "accepted",
      "proposed_channel": "isolated-npm",
      "evidence": [
        {
          "url": "https://registry.npmjs.org/cline/latest",
          "sha256": "1264e73c08a46e92975a60296dcc307415fd4dadc3ac94d5387cd4677bb54e23",
          "description": "cline-npm.json"
        }
      ],
      "artifacts": [
        {
          "name": "cline",
          "version": "3.0.61",
          "platform": "node",
          "url": "https://registry.npmjs.org/cline/-/cline-3.0.61.tgz",
          "digest": "sha512-dxO2ds7Yo97inD366+sSuKIx1f7jJ6Ab9S4txbuO2Jjn193Ky0+R4AopQKAOrCml09LDmI9onNnlM1kUFQlLAw==",
          "verification": "published-only"
        }
      ],
      "licence_observations": [],
      "remaining": [
        "Licence reviewed in the capability catalogue."
      ]
    },
    {
      "capability_id": "codex",
      "status": "accepted",
      "proposed_channel": "upstream-release",
      "evidence": [
        {
          "url": "https://raw.githubusercontent.com/openai/codex/HEAD/LICENSE",
          "sha256": "d17f227e4df5da1600391338865ce0f3055211760a36688f816941d58232d8dc",
          "description": "codex-license.txt"
        },
        {
          "url": "https://api.github.com/repos/openai/codex/releases/latest",
          "sha256": "9965860ac7d22c348e144f3c2932dc3f317149c90a01195bdb146e4728a073bb",
          "description": "codex-release.json"
        }
      ],
      "artifacts": [
        {
          "name": "codex-x86_64-unknown-linux-musl.tar.gz",
          "version": "rust-v0.154.0",
          "platform": "linux-amd64",
          "url": "https://github.com/openai/codex/releases/download/rust-v0.154.0/codex-x86_64-unknown-linux-musl.tar.gz",
          "digest": "sha256:d7e18b2597ae8f242f5f31ee9e90deef48dbc9edd634d9868fb6435d08c07f02",
          "verification": "published-only"
        }
      ],
      "licence_observations": [
        {
          "source": "https://raw.githubusercontent.com/openai/codex/HEAD/LICENSE",
          "labels": [
            "Apache-2.0 text observed"
          ],
          "sha256": "d17f227e4df5da1600391338865ce0f3055211760a36688f816941d58232d8dc",
          "scope": "Source text observation; not a release-specific licence approval."
        }
      ],
      "remaining": [
        "Licence reviewed in the capability catalogue."
      ]
    },
    {
      "capability_id": "containerd",
      "status": "accepted",
      "proposed_channel": "vendor-apt",
      "evidence": [
        {
          "url": "https://download.docker.com/linux/ubuntu/dists/resolute/stable/binary-amd64/Packages.gz",
          "sha256": "5353695c2ea2cd7b1945f22850d40a6377ef06c1422dd6772ffa2c3a4b211e7e",
          "description": "docker-packages.gz"
        }
      ],
      "artifacts": [
        {
          "name": "containerd.io",
          "version": "2.3.5-1~ubuntu.26.04~resolute",
          "platform": "linux-amd64",
          "url": "https://download.docker.com/linux/ubuntu/dists/resolute/pool/stable/amd64/containerd.io_2.3.5-1~ubuntu.26.04~resolute_amd64.deb",
          "digest": "sha256:a5988582d779e62dd968a1f2312ff8cd25670c185ebf94e4e5331ad1dcc1c287",
          "verification": "published-only"
        }
      ],
      "licence_observations": [],
      "remaining": [
        "Licence text observed at https://raw.githubusercontent.com/containerd/containerd/main/LICENSE."
      ],